type,title,date
Legislative Alert,Letter Asking House Members to Co-Sponsor the Richard L. Trumka PRO Act,"February 14, 2023"
Legislative Alert,"Letter Supporting Nomination of Casey Pitts for United States District Court Judge, Northern District of California","February 8, 2023"
Legislative Alert,Letter Opposing Legislation That Would Disrupt the Administrations COVID-19 Response,"January 31, 2023"
Legislative Alert,Letter Supporting Nomination of Todd Edelman to the U.S. District Court,"January 31, 2023"
Legislative Alert,Letter Supporting the Consolidated Appropriations Act (House),"January 3, 2023"
Legislative Alert,Letter Supporting Consolidated Appropriations Act (Senate),"January 3, 2023"
Legislative Alert,Letter Supporting Legislation that Will Expand Collective Bargaining Rights for VA Workers,"December 16, 2022"
Legislative Alert,Letter Supporting Legislation that Would Increase Transparency for Large Private Companies,"December 15, 2022"
Legislative Alert,Letter Opposing Creation of New Corporate Tax Loophole,"December 12, 2022"
Legislative Alert,House Letter Supporting Reauthorization of the Trade Adjustment Assistance Program,"December 12, 2022"
Legislative Alert,Senate Letter Supporting Reauthorization of the Trade Adjustment Assistance Program,"December 12, 2022"
Legislative Alert,Letter Supporting Legislation that Would Protect Noncitizen Veterans,"December 12, 2022"
Legislative Alert,Letter Supporting Marriage Equality,"November 21, 2022"
Legislative Alert,Letter Expressing Critical Needs for Upcoming Congressional Continuing Resolution,"September 28, 2022"
Legislative Alert,Letter Supporting Legislation that Will Prevent Future Insurrection Attempts,"September 22, 2022"
Legislative Alert,Letter Supporting Legislation that Will Bring Fairness to Social Security Beneficiaries,"September 20, 2022"
Legislative Alert,Letter Supporting the Inflation Reduction Act,"August 4, 2022"
Legislative Alert,Letter Supporting Legislation that Would Create a Federal Standard for Workplace Excessive Heat Prevention,"July 27, 2022"
